{
  "schema_version": "helios-runtime-reset-evidence.v1",
  "timestamp_utc": "2026-06-29T22:12:51Z",
  "platform": "macOS",
  "reset_by": "reset-tool",
  "operation_type": "Reset",
  "source_authority": "CurrentRuntimeBundleRoot",
  "akashic_root": "/Users/thispc/Engineering/Akashic",
  "runtime_bundle_root": "/Users/thispc/Engineering/Helios-/.command-gate",
  "helios_gate_root": "/Users/thispc/.helios/.command-gate",
  "pre_reset_detection_type": "BASELINE_REWRITE_SUSPECTED",
  "pre_reset_severity": "CRITICAL",
  "pre_reset_recommended_action": "RESET_FROM_REPO",
  "pre_reset_manifest_hash": "065875ebedf4e543a431da2eaedf3a959b291e771b924d33fa7e1b791a33860b",
  "pre_reset_sidecar_hash": "065875ebedf4e543a431da2eaedf3a959b291e771b924d33fa7e1b791a33860b",
  "pre_reset_origin_hash": "c0120dbf39b618e9569326fb1f55f4894890b9ec7eab2634d93cfdba81d1edb6",
  "pre_reset_detection": {
    "schema_version": "helios-runtime-detection.v1",
    "timestamp_utc": "2026-06-29T22:12:52Z",
    "platform": "macOS",
    "akashic_head": "b5debba4f390e4cc2e13474ea8bb67b434e597ae",
    "helios_head": "d102467e3f0e4724cd1928b03b0344a0a90e150f",
    "runtime_bundle_root": "/Users/thispc/Engineering/Helios-/.command-gate",
    "helios_gate_root": "/Users/thispc/.helios/.command-gate",
    "manifest_path": "/Users/thispc/.helios/.command-gate/manifest/helios-envelope.json",
    "sidecar_path": "/Users/thispc/.helios/.command-gate/manifest/helios-envelope.sha256",
    "install_origin_path": "/Users/thispc/.helios/.command-gate/manifest/helios-install-origin.json",
    "current_manifest_verdict": "CLEAN",
    "sidecar_verdict": "MATCH",
    "origin_verdict": "BASELINE_REWRITE_SUSPECTED",
    "detection_type": "BASELINE_REWRITE_SUSPECTED",
    "severity": "CRITICAL",
    "recommended_action": "RESET_FROM_REPO",
    "automation_mode": "DetectOnly",
    "affected_files": [
      {
        "path": "hooks/tier_classifier.ps1",
        "status": "DRIFT",
        "manifest_hash": "9257c080f63fe675c95a9caf9c5da571c915fbe47170c44c23de0493e3e3771c",
        "origin_hash": "9d41b12d982c0a50c706ba9ee1c17f5ebcd8ade959b7226b31019fbdbf024757",
        "actual_hash": "9257c080f63fe675c95a9caf9c5da571c915fbe47170c44c23de0493e3e3771c"
      }
    ],
    "expected_manifest_hashes": {
      "hooks/gate_check.ps1": "06a58750cd5a96c0b4be36e3ec1befeaa31fb90ce71324834d881c85075f6342",
      "hooks/evidence_capture.ps1": "beab97ea548f0edf0826fdc7365f23adef54cba9b21257d2ed0a8902fa832e0b",
      "hooks/tier_classifier.ps1": "9257c080f63fe675c95a9caf9c5da571c915fbe47170c44c23de0493e3e3771c",
      "hooks/helios_pretooluse.ps1": "31e6e82253aa1567367b92985973f799510b3ae17b89ac4379bc6e7092cac7b3",
      "hooks/lib/HeliosIntegrityBridge.ps1": "8008a336b8d5c35704aa677a57796807f8bb7790d3ff0a9af89767519c51e454",
      "policy/command-policy.json": "5e4fc670a3e03947d8ab0c5d64a1c59faf5c92dd887ee25474d147425359639f"
    },
    "actual_runtime_hashes": {
      "hooks/helios_pretooluse.ps1": "31e6e82253aa1567367b92985973f799510b3ae17b89ac4379bc6e7092cac7b3",
      "hooks/gate_check.ps1": "06a58750cd5a96c0b4be36e3ec1befeaa31fb90ce71324834d881c85075f6342",
      "hooks/evidence_capture.ps1": "beab97ea548f0edf0826fdc7365f23adef54cba9b21257d2ed0a8902fa832e0b",
      "hooks/tier_classifier.ps1": "9257c080f63fe675c95a9caf9c5da571c915fbe47170c44c23de0493e3e3771c",
      "hooks/lib/HeliosIntegrityBridge.ps1": "8008a336b8d5c35704aa677a57796807f8bb7790d3ff0a9af89767519c51e454",
      "policy/command-policy.json": "5e4fc670a3e03947d8ab0c5d64a1c59faf5c92dd887ee25474d147425359639f"
    },
    "expected_origin_hashes": {
      "hooks/helios_pretooluse.ps1": "31e6e82253aa1567367b92985973f799510b3ae17b89ac4379bc6e7092cac7b3",
      "hooks/gate_check.ps1": "06a58750cd5a96c0b4be36e3ec1befeaa31fb90ce71324834d881c85075f6342",
      "hooks/evidence_capture.ps1": "beab97ea548f0edf0826fdc7365f23adef54cba9b21257d2ed0a8902fa832e0b",
      "hooks/tier_classifier.ps1": "9d41b12d982c0a50c706ba9ee1c17f5ebcd8ade959b7226b31019fbdbf024757",
      "hooks/lib/HeliosIntegrityBridge.ps1": "8008a336b8d5c35704aa677a57796807f8bb7790d3ff0a9af89767519c51e454",
      "policy/command-policy.json": "5e4fc670a3e03947d8ab0c5d64a1c59faf5c92dd887ee25474d147425359639f"
    },
    "source_repo_status": {
      "verdict": "SOURCE_MATCH",
      "current_akashic_head": "b5debba4f390e4cc2e13474ea8bb67b434e597ae",
      "recorded_akashic_head": "b5debba4f390e4cc2e13474ea8bb67b434e597ae",
      "current_helios_head": "d102467e3f0e4724cd1928b03b0344a0a90e150f",
      "recorded_helios_head": "d102467e3f0e4724cd1928b03b0344a0a90e150f",
      "changed_source_files": []
    },
    "bridge_status": {
      "verdict": "BRIDGE_MATCH",
      "current_source_hash": "8008a336b8d5c35704aa677a57796807f8bb7790d3ff0a9af89767519c51e454",
      "current_installed_hash": "8008a336b8d5c35704aa677a57796807f8bb7790d3ff0a9af89767519c51e454",
      "origin_source_hash": "8008a336b8d5c35704aa677a57796807f8bb7790d3ff0a9af89767519c51e454",
      "origin_installed_hash": "8008a336b8d5c35704aa677a57796807f8bb7790d3ff0a9af89767519c51e454"
    },
    "evidence_paths": [
      "/Users/thispc/.helios/.command-gate/evidence/detections/20260629-221252-BASELINE_REWRITE_SUSPECTED.json",
      "/Users/thispc/Engineering/Akashic/evidence/phase432d/20260629-221252-BASELINE_REWRITE_SUSPECTED.json"
    ],
    "automation_result": "DETECTED"
  },
  "old_runtime_hashes": {
    "hooks/helios_pretooluse.ps1": "31e6e82253aa1567367b92985973f799510b3ae17b89ac4379bc6e7092cac7b3",
    "hooks/gate_check.ps1": "06a58750cd5a96c0b4be36e3ec1befeaa31fb90ce71324834d881c85075f6342",
    "hooks/evidence_capture.ps1": "beab97ea548f0edf0826fdc7365f23adef54cba9b21257d2ed0a8902fa832e0b",
    "hooks/tier_classifier.ps1": "9257c080f63fe675c95a9caf9c5da571c915fbe47170c44c23de0493e3e3771c",
    "hooks/lib/HeliosIntegrityBridge.ps1": "8008a336b8d5c35704aa677a57796807f8bb7790d3ff0a9af89767519c51e454",
    "policy/command-policy.json": "5e4fc670a3e03947d8ab0c5d64a1c59faf5c92dd887ee25474d147425359639f"
  },
  "old_origin_runtime_bundle_root": "/Users/thispc/Engineering/Helios-/.command-gate",
  "old_helios_head": "d102467e3f0e4724cd1928b03b0344a0a90e150f",
  "old_akashic_head": "b5debba4f390e4cc2e13474ea8bb67b434e597ae",
  "post_reset_manifest_hash": "388ac57ed3db92fd596e86f47e21ea9945225ab31c185f306612aacc3695b290",
  "post_reset_sidecar_hash": "388ac57ed3db92fd596e86f47e21ea9945225ab31c185f306612aacc3695b290",
  "post_reset_origin_hash": "f7115694d0f695c5437f889b45d2607b07716650c2824e6b7d1f0dc35adc8120",
  "post_reset_manifest_verdict": "CLEAN",
  "post_reset_origin_verdict": "MATCH",
  "new_runtime_hashes": {
    "hooks/helios_pretooluse.ps1": "31e6e82253aa1567367b92985973f799510b3ae17b89ac4379bc6e7092cac7b3",
    "hooks/gate_check.ps1": "06a58750cd5a96c0b4be36e3ec1befeaa31fb90ce71324834d881c85075f6342",
    "hooks/evidence_capture.ps1": "beab97ea548f0edf0826fdc7365f23adef54cba9b21257d2ed0a8902fa832e0b",
    "hooks/tier_classifier.ps1": "9d41b12d982c0a50c706ba9ee1c17f5ebcd8ade959b7226b31019fbdbf024757",
    "hooks/lib/HeliosIntegrityBridge.ps1": "8008a336b8d5c35704aa677a57796807f8bb7790d3ff0a9af89767519c51e454",
    "policy/command-policy.json": "5e4fc670a3e03947d8ab0c5d64a1c59faf5c92dd887ee25474d147425359639f"
  },
  "new_runtime_bundle_root": "/Users/thispc/Engineering/Helios-/.command-gate",
  "new_helios_head": "d102467e3f0e4724cd1928b03b0344a0a90e150f",
  "new_akashic_head": "b5debba4f390e4cc2e13474ea8bb67b434e597ae",
  "final_detection_type": "ORIGIN_MATCH",
  "final_detection_severity": "INFO",
  "final_origin_match": true,
  "archive_path": "/Users/thispc/.helios/.command-gate/maintenance/archives/20260629-221251-reset",
  "archived_files": [
    "manifest/helios-envelope.json",
    "manifest/helios-envelope.sha256",
    "manifest/helios-install-origin.json",
    "protected/hooks/helios_pretooluse.ps1",
    "protected/hooks/gate_check.ps1",
    "protected/hooks/evidence_capture.ps1",
    "protected/hooks/tier_classifier.ps1",
    "protected/hooks/lib/HeliosIntegrityBridge.ps1",
    "protected/policy/command-policy.json"
  ],
  "preserved_dirs": [
    "pending",
    "inflight",
    "evidence",
    "blocked"
  ],
  "hooks_deactivated": false,
  "hooks_reactivated": false,
  "files_unlocked": false,
  "files_relocked": false,
  "destructive_removal": false,
  "reactivation_requested": false,
  "relock_requested": false,
  "steps": [
    {
      "step": "Assert Akashic trusted",
      "status": "PASS",
      "detail": "Self-integrity verified"
    },
    {
      "step": "Pre-reset detection",
      "status": "PASS",
      "detail": {
        "detection_type": "BASELINE_REWRITE_SUSPECTED",
        "severity": "CRITICAL",
        "recommended_action": "RESET_FROM_REPO"
      }
    },
    {
      "step": "Write pre-reset detection",
      "status": "PASS",
      "detail": "BASELINE_REWRITE_SUSPECTED"
    },
    {
      "step": "Deactivate hooks",
      "status": "SKIP",
      "detail": "Not requested (pass -DisableHooksDuringReset)"
    },
    {
      "step": "Unlock runtime files",
      "status": "SKIP",
      "detail": "Files already writable"
    },
    {
      "step": "Archive active baseline",
      "status": "PASS",
      "detail": {
        "archive_path": "/Users/thispc/.helios/.command-gate/maintenance/archives/20260629-221251-reset",
        "files_archived": 9
      }
    },
    {
      "step": "Verify mutable dirs preserved",
      "status": "PASS",
      "detail": {
        "preserved": [
          "pending",
          "inflight",
          "evidence",
          "blocked"
        ],
        "count": 4
      }
    },
    {
      "step": "Copy protected files from RuntimeBundleRoot",
      "status": "PASS",
      "detail": "5 files copied"
    },
    {
      "step": "Sync Akashic bridge",
      "status": "PASS",
      "detail": "Bridge synced from Akashic source"
    },
    {
      "step": "Generate fresh manifest",
      "status": "PASS",